{
  "schema_version": "0.1.0",
  "name": "ednet-cross-subset",
  "members": ["ednet"],
  "shared_schema": true,
  "shift_axis": "subset",
  "pair_type": "intra-dataset-env-split",
  "train_env": ["KT1"],
  "ood_test_env": ["KT4"],
  "epistemic_state": {
    "facts": ["131M interactions / 784k students across KT1/KT2/KT3/KT4 subsets (TOEIC-prep, 2017-19)."],
    "hypotheses": [
      "KT1→KT4 is a schema-expansion shift (more action types tracked) rather than a behavior shift (newer-feature users behaving differently).",
      "Knowledge-tracing models transfer across subsets (KT1→KT4)."
    ],
    "intuitions": ["Knowledge-tracing benchmark surveys 2024-25; foundation-edu-model attempts on EdNet."],
    "unknowns": [
      "Single-platform / single-subject (TOEIC) — domain transfer not askable.",
      "Santa platform UI shapes behavior — UI-as-confounder not exposed."
    ]
  },
  "baselines": []
}
