{
  "schema_version": "0.1.0",
  "name": "lhc-olympics-blind-bb",
  "members": ["lhc-olympics-2020"],
  "shared_schema": true,
  "shift_axis": "blind-injection",
  "pair_type": "intra-dataset-env-split",
  "train_env": ["RnD"],
  "ood_test_env": ["BB1", "BB2", "BB3"],
  "epistemic_state": {
    "facts": ["1M+1M R&D events with known signal+background; 3 black-box datasets with unknown injected anomalies; simulates MC-to-data gap."],
    "hypotheses": [
      "Black-box anomaly scores correlate with R&D training.",
      "Anomaly detection generalizes across the 3 black boxes (BB1→BB2, BB3)."
    ],
    "intuitions": ["An LHC Olympics retrospective spanning 2020-2024 and ATLAS/CMS anomaly detection in actual Run 2/3 data likely exist."],
    "unknowns": ["MC-to-data shift is compound (showers + hadronization + detector + pileup), and there is no established primitive for a 'compound shift mechanism'."]
  },
  "baselines": []
}
