{
  "schema_version": "0.1.0",
  "name": "replication-pair",
  "members": ["osc-score-birmingham"],
  "shared_schema": true,
  "shift_axis": "original-vs-replication",
  "pair_type": "replication",
  "train_env": ["original"],
  "ood_test_env": ["replication"],
  "epistemic_state": {
    "facts": ["OSC RPP 100 (psychology 2015) + DARPA SCORE ~3000 + Birmingham 1,051+ original-vs-replication pairs across fields."],
    "hypotheses": [
      "Original-vs-replication is a compound shift (sample + analyst + analysis-method), not a single shift type.",
      "Replication rates are consistent across fields."
    ],
    "intuitions": ["2024-25 replication meta-analyses; AI-prediction-of-replicability literature."],
    "unknowns": [
      "'Replication' contested — exact vs conceptual vs systematic pooled but mechanistically different.",
      "Single-shot pair-as-unit presupposed; many-lab replications carry different signal but are rarer."
    ]
  },
  "baselines": []
}
