{
  "schema_version": "0.1.0",
  "name": "tdc-cross-task-suite",
  "members": ["tdc-suite", "tdc-caco2"],
  "shared_schema": false,
  "shift_axis": "split-type",
  "pair_type": "intra-dataset-env-split",
  "train_env": ["task-train"],
  "ood_test_env": ["task-scaffold-test", "task-cold-test", "task-temporal-test"],
  "epistemic_state": {
    "facts": ["66+ datasets across drug discovery; built-in scaffold / cold-start / temporal splits per task."],
    "hypotheses": [
      "A single ADMET generalist method wins across all 22 endpoints.",
      "The temporal split gives a more honest estimate of real-world generalization than the scaffold split."
    ],
    "intuitions": ["TDC leaderboard SOTA 2024-25; cross-TDC foundation-model results."],
    "unknowns": [
      "TDC bundles heterogeneous tasks under 'drug discovery' — structural coherence presupposed, not justified.",
      "'Cold-start' is defined differently per task, so inter-task consistency cannot be determined."
    ]
  },
  "baselines": []
}
