{
  "schema_version": "0.1.0",
  "name": "bosch-cross-machine",
  "members": ["bosch-cnc"],
  "shared_schema": true,
  "shift_axis": "machine",
  "pair_type": "intra-dataset-env-split",
  "train_env": ["M1", "M2"],
  "ood_test_env": ["M3"],
  "epistemic_state": {
    "facts": ["3 CNC mills × 15 programs × 6×6-month windows of triaxial accelerometer + binary anomaly label."],
    "hypotheses": [
      "Cross-machine shift M1+M2→M3 is categorically different from within-machine 2-year temporal drift rather than factorable through a hidden 'machine state' environment.",
      "The 6-month window reflects a mechanism (tool-wear cycle) rather than only data-collection cadence."
    ],
    "intuitions": [
      "Tnani 2022 CIRP follow-ups 2023-25 and SSMSPC extensions likely exist.",
      "Brownfield-vs-greenfield deployment work using this dataset likely exists."
    ],
    "unknowns": [
      "Whether 'machining process' is a labelled unit or a discovered segmentation cannot be decided from the accelerometer alone, which leaves process-driven and temporal framings for tool-wear indistinguishable."
    ]
  },
  "baselines": []
}
