{
  "schema_version": "0.1.0",
  "name": "primekg-vs-hetionet-cross-kg",
  "members": ["primekg", "hetionet"],
  "shared_schema": false,
  "shift_axis": "kg-integration",
  "pair_type": "cross-source",
  "train_env": ["hetionet"],
  "ood_test_env": ["primekg"],
  "epistemic_state": {
    "facts": ["Two biomedical KGs integrated from overlapping sources (29 for Hetionet, 20 for PrimeKG); different integration choices, different snapshot dates (2017 vs 2023)."],
    "hypotheses": [
      "Integration choices change which methods generalize, not merely by how much.",
      "The discrete version axis (Hetionet 2017 vs PrimeKG 2023) constitutes a temporal shift even though both KGs are individually T=0.",
      "Cross-KG transfer is directionally asymmetric: training on Hetionet then evaluating on PrimeKG differs in difficulty from the reverse."
    ],
    "intuitions": [
      "Head-to-head PrimeKG vs Hetionet benchmarks 2024-25.",
      "TxGNN methodology applied to Hetionet for comparison."
    ],
    "unknowns": [
      "'Version-as-environment' across sibling KGs is a candidate shift primitive that is not yet named.",
      "Whether the integration step creates or averages out the cross-resource shift."
    ]
  },
  "baselines": []
}
